{
  "schema_version": "1.0",
  "mapping_id": "44444444-4444-4444-8444-444444444444",
  "project_id": "11111111-1111-4111-8111-111111111111",
  "event_id": "33333333-3333-4333-8333-333333333333",
  "jira_instance_key": "mock-jira",
  "jira_issue_key": "AUTH-101",
  "relationship_type": "ADDRESSES_REPORTED_ISSUE",
  "origin": "MANUAL",
  "verification_status": "CONFIRMED",
  "version": 2,
  "created_at": "2026-10-14T01:00:00Z",
  "reviewed_at": "2026-10-14T01:00:00Z",
  "reviewed_by": "po-test-1"
}
